Ano;Turno;Município;Número;Candidato;Zona;Seção;Seções Agregadas;Votos;Local de Votação;Endereço Local de Votação;Bairro;
2024;1;AQUIRAZ;15222;DARLAN SARAIVA;66;107;;1;EMEFJUSCELINO KUBITSCHEK;AV ANTONIO LOURENÇO DA SILVA S/N;CAPONGA DA BERNARDA;
2024;1;AQUIRAZ;15222;DARLAN SARAIVA;66;123;;1;EMEFJUSCELINO KUBITSCHEK;AV ANTONIO LOURENÇO DA SILVA S/N;CAPONGA DA BERNARDA;
2024;1;AQUIRAZ;15222;DARLAN SARAIVA;66;164;;1;CENTRO DE REABILITAÇÃO FÍSICA - PSF - FAGUNDES;CE-453 N 98;TAPERA;
2024;1;AQUIRAZ;15222;DARLAN SARAIVA;66;231;;1;ESCOLA FERDINANDO TANSI (SUBSTITUTA DA ESCOLA FCO. VIDAL CAMARA);COMUNIDADE DO PIAU;PICAO;
2024;1;AQUIRAZ;15222;DARLAN SARAIVA;66;298;;2;SENAC - SERVIÇO NACIONAL DO COMÉRCIO;RUA PEDRO BRASIL, N 210;CENTRO;
2024;1;AQUIRAZ;15222;DARLAN SARAIVA;66;348;;1;ESCOLA FERDINANDO TANSI (SUBSTITUTA DA ESCOLA FCO. VIDAL CAMARA);COMUNIDADE DO PIAU;PICAO;
TOTAL;;;;;;;;7;
